{
  "schema": 1,
  "lang": "python",
  "mode": "sdk",
  "backend": "claude-code",
  "network": "kermit",
  "task": {
    "id": "lite-account",
    "file": "01-lite-account.yaml",
    "title": "Lite account setup",
    "specHash": "6cee357d09fe"
  },
  "sdkVersion": "2.2.1",
  "passed": true,
  "turns": 15,
  "interventions": 0,
  "failureClass": null,
  "assertions": [
    {
      "assertion": "lite_token_account_balance > 0",
      "subject": "lite_token_account_balance",
      "op": ">",
      "passed": true,
      "actual": "1000000000",
      "actualAcme": 10,
      "expected": 0
    }
  ],
  "artifacts": {
    "liteIdentityUrl": "acc://5bf0dd4b4554b8a04e734c232d78ddf6ac1b722c426af05d",
    "liteTokenAccountUrl": "acc://5bf0dd4b4554b8a04e734c232d78ddf6ac1b722c426af05d/ACME",
    "txid": "acc://4330f5d3c8289547543baf639c2e24b5116e3cba0ba02474e12ea570d53f9c18@61c57f92a56e5db6b44afcc9add522c014512b1d64fa5ad0/ACME",
    "txids": [
      "acc://4330f5d3c8289547543baf639c2e24b5116e3cba0ba02474e12ea570d53f9c18@61c57f92a56e5db6b44afcc9add522c014512b1d64fa5ad0/ACME"
    ]
  },
  "environment": {
    "liteIdentity": "acc://fd876be49690926d3d0b948e424f4b5500c834341e9fef96",
    "liteTokenAccount": "acc://fd876be49690926d3d0b948e424f4b5500c834341e9fef96/ACME",
    "publicKeyHex": "760b75be325d308764a9a7cc254693473635f0b69a145a8d2bd41d5a821ad660",
    "suggestedAdiUrl": "acc://harness-3047e57d.acme"
  },
  "durationMs": 133144,
  "transcriptPath": "C:\\Accumulate_Stuff\\on-boarding-platform\\accumulate-studio\\tools\\agent-harness\\results\\2026-07-27\\sdk\\transcripts\\python--lite-account.txt",
  "error": null,
  "startedAt": "2026-07-27T21:26:54.061Z",
  "finishedAt": "2026-07-27T21:29:36.265Z"
}