{
  "schema": 1,
  "lang": "dart",
  "mode": "sdk",
  "backend": "claude-code",
  "network": "kermit",
  "task": {
    "id": "create-adi",
    "file": "02-create-adi.yaml",
    "title": "Create an ADI (Accumulate Digital Identifier)",
    "specHash": "93a188817a2e"
  },
  "sdkVersion": "2.3.10",
  "passed": true,
  "turns": 23,
  "interventions": 0,
  "failureClass": null,
  "assertions": [
    {
      "assertion": "adi_account_exists == true",
      "subject": "adi_account_exists",
      "op": "==",
      "passed": true,
      "actual": true,
      "expected": true
    },
    {
      "assertion": "key_book_exists == true",
      "subject": "key_book_exists",
      "op": "==",
      "passed": true,
      "actual": true,
      "expected": true
    }
  ],
  "artifacts": {
    "liteIdentityUrl": "acc://7ee80c0b5bc2a01940a2c33eaef523b7b37876197effc84f",
    "liteTokenAccountUrl": "acc://7ee80c0b5bc2a01940a2c33eaef523b7b37876197effc84f/ACME",
    "adiUrl": "acc://harness-e85ed2e7.acme",
    "keyBookUrl": "acc://harness-e85ed2e7.acme/book",
    "keyPageUrl": "acc://harness-e85ed2e7.acme/book/1",
    "txid": "acc://f556dd0430b8428c2b644d4a0fa570f7a6a13d7e45f88015a4ceadb5bee9b68e@7ee80c0b5bc2a01940a2c33eaef523b7b37876197effc84f/ACME",
    "txids": [
      "acc://0722c7eaec40e567b3b47c88fb04e268e6089b89b363281c32eafa93b8ec2728@7ee80c0b5bc2a01940a2c33eaef523b7b37876197effc84f/ACME",
      "acc://f556dd0430b8428c2b644d4a0fa570f7a6a13d7e45f88015a4ceadb5bee9b68e@7ee80c0b5bc2a01940a2c33eaef523b7b37876197effc84f/ACME"
    ]
  },
  "environment": {
    "liteIdentity": "acc://7ee80c0b5bc2a01940a2c33eaef523b7b37876197effc84f",
    "liteTokenAccount": "acc://7ee80c0b5bc2a01940a2c33eaef523b7b37876197effc84f/ACME",
    "publicKeyHex": "b8ef434143ef730c9f880d8e1544ccdd438d63050e636ae8ce0ba249a4f618c4",
    "suggestedAdiUrl": "acc://harness-e85ed2e7.acme"
  },
  "durationMs": 343059,
  "transcriptPath": "C:\\Accumulate_Stuff\\on-boarding-platform\\accumulate-studio\\tools\\agent-harness\\results\\2026-07-31\\sdk\\transcripts\\dart--create-adi.txt",
  "error": null,
  "startedAt": "2026-07-31T23:13:24.458Z",
  "finishedAt": "2026-07-31T23:19:34.040Z"
}