{
  "schema": 1,
  "lang": "javascript",
  "mode": "sdk",
  "backend": "claude-code",
  "network": "kermit",
  "task": {
    "id": "write-data",
    "file": "05-write-data.yaml",
    "title": "Write data to a data account",
    "specHash": "9e9c1d819284"
  },
  "sdkVersion": "2.2.0",
  "passed": true,
  "turns": 26,
  "interventions": 0,
  "failureClass": null,
  "assertions": [
    {
      "assertion": "data_account_exists == true",
      "subject": "data_account_exists",
      "op": "==",
      "passed": true,
      "actual": true,
      "expected": true
    },
    {
      "assertion": "retrieved_entry == payload",
      "subject": "retrieved_entry",
      "op": "==",
      "passed": true,
      "actual": "hello accumulate",
      "expected": "hello accumulate"
    }
  ],
  "artifacts": {
    "liteIdentityUrl": "acc://2082f99ef6ab3cee472ac66b513c1a38b1979ebf2f73774e",
    "liteTokenAccountUrl": "acc://2082f99ef6ab3cee472ac66b513c1a38b1979ebf2f73774e/ACME",
    "adiUrl": "acc://harness-b2c89eaf-js.acme",
    "keyBookUrl": "acc://harness-b2c89eaf-js.acme/book",
    "keyPageUrl": "acc://harness-b2c89eaf-js.acme/book/1",
    "dataAccountUrl": "acc://harness-b2c89eaf-js.acme/data",
    "entryHash": "80d921ad4f794fb7a41108b6d06440dc7cd613c7fc3a96aca772bf8a688f1d75",
    "txid": "acc://2e3d48d7d7c0915ac0800e61068d22e115738be27c18275d517b8fd6cbd5ff82@harness-b2c89eaf-js.acme/data",
    "txids": [
      "acc://007d86cf8aea58a52f0dc81e061c55844665dca0e71ea7248062c71004578f26@2082f99ef6ab3cee472ac66b513c1a38b1979ebf2f73774e/ACME",
      "acc://19066cce085dc84ed511cc8e431ea959e061144cea3b57443d5b298a0fd7db8a@2082f99ef6ab3cee472ac66b513c1a38b1979ebf2f73774e/ACME",
      "acc://41179dcc65d9a0745f2661f7bd3809894823d594e501c10c4f31e4a2d8d61e33@harness-b2c89eaf-js.acme",
      "acc://2e3d48d7d7c0915ac0800e61068d22e115738be27c18275d517b8fd6cbd5ff82@harness-b2c89eaf-js.acme/data"
    ],
    "retrievedEntry": "hello accumulate"
  },
  "environment": {
    "liteIdentity": "acc://2082f99ef6ab3cee472ac66b513c1a38b1979ebf2f73774e",
    "liteTokenAccount": "acc://2082f99ef6ab3cee472ac66b513c1a38b1979ebf2f73774e/ACME",
    "publicKeyHex": "f8066a5d499581bf2152904a9a5adb5678ffe8f8894956c78ae8eba0afe9efd7",
    "suggestedAdiUrl": "acc://harness-b2c89eaf.acme"
  },
  "durationMs": 396789,
  "transcriptPath": "C:\\Accumulate_Stuff\\on-boarding-platform\\accumulate-studio\\tools\\agent-harness\\results\\2026-07-28\\sdk\\transcripts\\javascript--write-data.txt",
  "error": null,
  "startedAt": "2026-07-28T02:56:28.790Z",
  "finishedAt": "2026-07-28T03:07:39.207Z"
}