{
  "schema": 1,
  "lang": "python",
  "mode": "cli",
  "backend": "claude-code",
  "network": "kermit",
  "task": {
    "id": "create-adi",
    "file": "02-create-adi.yaml",
    "title": "Create an ADI (Accumulate Digital Identifier)",
    "specHash": "93a188817a2e"
  },
  "sdkVersion": "2.3.3",
  "passed": true,
  "turns": 18,
  "interventions": 0,
  "failureClass": null,
  "assertions": [
    {
      "assertion": "adi_account_exists == true",
      "subject": "adi_account_exists",
      "op": "==",
      "passed": true,
      "actual": true,
      "expected": true
    },
    {
      "assertion": "key_book_exists == true",
      "subject": "key_book_exists",
      "op": "==",
      "passed": true,
      "actual": true,
      "expected": true
    }
  ],
  "artifacts": {
    "liteIdentityUrl": "acc://279e0dc397f42a7d9f5f7d63cf8bef61d6515888550b149d",
    "liteTokenAccountUrl": "acc://279e0dc397f42a7d9f5f7d63cf8bef61d6515888550b149d/ACME",
    "adiUrl": "acc://harness-1b410180.acme",
    "keyBookUrl": "acc://harness-1b410180.acme/book",
    "keyPageUrl": "acc://harness-1b410180.acme/book/1",
    "txid": "acc://f56978f5ad8f3616afe5d6c9f5784fcedbed4753463a791d0a249634fa3e0b88@279e0dc397f42a7d9f5f7d63cf8bef61d6515888550b149d",
    "txids": [
      "acc://5e1428070d5db1973c3904b7ad2630a6d89bce3338ae61bfd75a4e4525a30612@279e0dc397f42a7d9f5f7d63cf8bef61d6515888550b149d/ACME",
      "acc://f56978f5ad8f3616afe5d6c9f5784fcedbed4753463a791d0a249634fa3e0b88@279e0dc397f42a7d9f5f7d63cf8bef61d6515888550b149d"
    ]
  },
  "environment": {
    "liteIdentity": "acc://279e0dc397f42a7d9f5f7d63cf8bef61d6515888550b149d",
    "liteTokenAccount": "acc://279e0dc397f42a7d9f5f7d63cf8bef61d6515888550b149d/ACME",
    "publicKeyHex": "a35d1955f08d73a6bf1ec1049b76ad5700548ae118014ccdd3fcab6f03cd5e1b",
    "suggestedAdiUrl": "acc://harness-1b410180.acme"
  },
  "durationMs": 294409,
  "transcriptPath": "C:\\Accumulate_Stuff\\on-boarding-platform\\accumulate-studio\\tools\\agent-harness\\results\\2026-07-30\\cli\\transcripts\\python--create-adi.txt",
  "error": null,
  "startedAt": "2026-07-30T21:52:35.993Z",
  "finishedAt": "2026-07-30T21:58:43.914Z"
}