{
  "schema": 1,
  "lang": "csharp",
  "mode": "sdk",
  "backend": "claude-code",
  "network": "kermit",
  "task": {
    "id": "lite-account",
    "file": "01-lite-account.yaml",
    "title": "Lite account setup",
    "specHash": "6cee357d09fe"
  },
  "sdkVersion": "2.3.2",
  "passed": true,
  "turns": 28,
  "interventions": 0,
  "failureClass": null,
  "assertions": [
    {
      "assertion": "lite_token_account_balance > 0",
      "subject": "lite_token_account_balance",
      "op": ">",
      "passed": true,
      "actual": "2000000000",
      "actualAcme": 20,
      "expected": 0
    }
  ],
  "artifacts": {
    "liteIdentityUrl": "acc://c4e04f697b55894764eef0cd72f01ba817834ee9ad4b618c",
    "liteTokenAccountUrl": "acc://c4e04f697b55894764eef0cd72f01ba817834ee9ad4b618c/ACME",
    "txid": "acc://be755413600aa0e3b74ed84cad4b0f10d4c931647bffaa554afd513adffb98cf@61c57f92a56e5db6b44afcc9add522c014512b1d64fa5ad0/ACME",
    "txids": [
      "acc://be755413600aa0e3b74ed84cad4b0f10d4c931647bffaa554afd513adffb98cf@61c57f92a56e5db6b44afcc9add522c014512b1d64fa5ad0/ACME",
      "acc://036633e25bcbfe8d69214a29a02d78151a5810beca824b4f096deab13ac7d663@61c57f92a56e5db6b44afcc9add522c014512b1d64fa5ad0/ACME"
    ]
  },
  "environment": {
    "liteIdentity": "acc://7fac6690edf6861a71267eb276a1aa4a7776c0fc449732f8",
    "liteTokenAccount": "acc://7fac6690edf6861a71267eb276a1aa4a7776c0fc449732f8/ACME",
    "publicKeyHex": "0d6206a48448a2282dcc22f5ec17fc63c6065a758f8fbad3c4b5e694ab47e38f",
    "suggestedAdiUrl": "acc://harness-b1c0d108.acme"
  },
  "durationMs": 370966,
  "transcriptPath": "C:\\Accumulate_Stuff\\on-boarding-platform\\accumulate-studio\\tools\\agent-harness\\results\\2026-07-29\\sdk\\transcripts\\csharp--lite-account.txt",
  "error": null,
  "startedAt": "2026-07-29T08:30:40.472Z",
  "finishedAt": "2026-07-29T08:38:32.684Z"
}