{
  "schema": 1,
  "lang": "rust",
  "mode": "sdk",
  "backend": "claude-code",
  "network": "kermit",
  "task": {
    "id": "send-tokens",
    "file": "04-send-tokens.yaml",
    "title": "Send ACME tokens between accounts",
    "specHash": "04b11771f6b0"
  },
  "sdkVersion": "2.3.2",
  "passed": true,
  "turns": 22,
  "interventions": 0,
  "failureClass": null,
  "assertions": [
    {
      "assertion": "tx_status == delivered",
      "subject": "tx_status",
      "op": "==",
      "passed": true,
      "actual": "delivered",
      "expected": "delivered"
    },
    {
      "assertion": "recipient_balance_increased_by == 5 ACME",
      "subject": "recipient_balance_increased_by",
      "op": "==",
      "passed": true,
      "actual": "500000000",
      "actualAcme": 5,
      "expected": "5 ACME"
    }
  ],
  "artifacts": {
    "adiUrl": "acc://harness-1785310391779.acme",
    "keyBookUrl": "acc://harness-1785310391779.acme/book",
    "keyPageUrl": "acc://harness-1785310391779.acme/book/1",
    "liteIdentityUrl": "acc://3ea118a74b7392eaeb96f279fe26852f2b1d015b3e254f83",
    "liteTokenAccountUrl": "acc://3ea118a74b7392eaeb96f279fe26852f2b1d015b3e254f83/ACME",
    "recipientUrl": "acc://harness-1785310391779.acme/tokens",
    "txid": "acc://b044f0ca3fa3aeb9f3d828a90e313c957d627006c12050a79ece9c958d916dab@3ea118a74b7392eaeb96f279fe26852f2b1d015b3e254f83",
    "txids": [
      "acc://f42547a31fc93c48a59cf6d17559e55f964ad8b91b06fec52a5f05206e0ba145@3ea118a74b7392eaeb96f279fe26852f2b1d015b3e254f83",
      "acc://25ff28462bd23c6003e97a2852ee178bf0d8bec92c22c33e74952a18b2e7ef39@3ea118a74b7392eaeb96f279fe26852f2b1d015b3e254f83",
      "acc://c2e43522fecb531dc3d8f3901614a05e89e79877bc5ba6eacc912778f4797f1e@3ea118a74b7392eaeb96f279fe26852f2b1d015b3e254f83",
      "acc://afd2c20d37f480071978c0ca24c276e7de23b2031234479c7dbe17ca1134a10f@harness-1785310391779.acme/book/1",
      "acc://b044f0ca3fa3aeb9f3d828a90e313c957d627006c12050a79ece9c958d916dab@3ea118a74b7392eaeb96f279fe26852f2b1d015b3e254f83"
    ]
  },
  "environment": {
    "liteIdentity": "acc://3ea118a74b7392eaeb96f279fe26852f2b1d015b3e254f83",
    "liteTokenAccount": "acc://3ea118a74b7392eaeb96f279fe26852f2b1d015b3e254f83/ACME",
    "publicKeyHex": "00ab89a44afb6d12917cb80daddd9e3f7e454952a75c936a5cce212e4ae05cef",
    "suggestedAdiUrl": "acc://harness-22e1f063.acme"
  },
  "durationMs": 399813,
  "transcriptPath": "C:\\Accumulate_Stuff\\on-boarding-platform\\accumulate-studio\\tools\\agent-harness\\results\\2026-07-29\\sdk\\transcripts\\rust--send-tokens.txt",
  "error": null,
  "startedAt": "2026-07-29T07:27:13.851Z",
  "finishedAt": "2026-07-29T07:34:25.591Z"
}